{
  "title": "A group containing references to datasets",
  "alternativeTitle": [
    "Dataset reference group"
  ],
  "description": "An example of the object that will allow datasets to be grouped. The datasets are identified an reference id. This is a sub-type of Dataset",
  "keyword": [
  ],
  "theme": [
  ],
  "contactPoint": {
    "contactName": "Rob Nichols",
    "email": "robert.nichols@digital.cabinet-office.gov.uk"
  },
  "creator": [
    "central-digital-and-data-office"
  ],
  "publisher": "academy-for-social-justice",
  "securityClassification": "OFFICIAL",
  "identifier": "8d085327-21b6-4d8b-9705-88faad231d99",
  "relatedResource": [
    ""
  ],
  "member": [
    "8d085327-21b6-4d8b-9705-88faad231d22",
    "8d085327-21b6-4d8b-9705-88faad231d62",
    "8d085327-21b6-4d8b-9705-88faad231d63"
  ]
}

