{
  "title": "A group containing a dataset",
  "alternativeTitle": [
    "Dataset group"
  ],
  "description": "An example of the object that will allow datasets to be grouped. This is a sub-type of Dataset",
  "keyword": [
  ],
  "theme": [
  ],
  "contactPoint": {
    "contactName": "Rob Nichols",
    "email": "robert.nichols@digital.cabinet-office.gov.uk"
  },
  "creator": [
    "central-digital-and-data-office"
  ],
  "publisher": "academy-for-social-justice",
  "securityClassification": "OFFICIAL",
  "identifier": "8d085327-21b6-4d8b-9705-88faad231d99",
  "relatedResource": [
    ""
  ],
  "member": [
    {
      "title": "Advance Passenger Information (API) ",
      "alternativeTitle": [
        "Travel Data"
      ],
      "summary": "Airline passenger travel data",
      "description": "Travel data and personal data given to airlines by passenger. API covers  both inbound and outbound air passengers. API includes the passengerâ€™s full name, nationality, date of birth, gender and travel document number, type and country of issue.The data does not include those arriving by sea or rail routes, by private aircraft or via the Common Travel Area (CTA).",
      "keyword": [
        "Air travel",
        "Passport",
        "Airports",
        "leaving UK",
        "entering UK"

      ],
      "theme": [
        "Transport and infrastructure",
        "Population and society"
      ],
      "contactPoint": {
        "contactName": "Rob Nichols",
        "email": "robert.nichols@digital.cabinet-office.gov.uk"
      },
      "creator": [
        "central-digital-and-data-office"
      ],
      "publisher": "academy-for-social-justice",
      "securityClassification": "OFFICIAL",
      "identifier": "8d085327-21b6-4d8b-9705-88faad231d62",
      "relatedResource": [
        ""
      ]
    }
  ]
}
